budget__C,temp_genre__c,homepage__c,external_id__c,temp_keyword__c,original_language__c,original_title__C,overview__c,popularity__c,temp_production_company__c,temp_production_country__c,release_date__c,revenue__c,runtime__c,temp_spoken_language__c,status__c,tagline__c,title__c,vote_average__c,vote_count__c,name
175000000,"[{""id"": 12, ""name"": ""Adventure""}, {""id"": 18, ""name"": ""Drama""}, {""id"": 10752, ""name"": ""War""}]",,652,"[{""id"": 380, ""name"": ""brother brother relationship""}, {""id"": 596, ""name"": ""adultery""}, {""id"": 2035, ""name"": ""mythology""}, {""id"": 3258, ""name"": ""beauty""}, {""id"": 3265, ""name"": ""trojan war""}, {""id"": 3930, ""name"": ""bravery""}, {""id"": 4372, ""name"": ""wall""}, {""id"": 4373, ""name"": ""fraud""}, {""id"": 6062, ""name"": ""hostility""}, {""id"": 6917, ""name"": ""epic""}, {""id"": 9725, ""name"": ""sword fight""}, {""id"": 10141, ""name"": ""battlefield""}, {""id"": 14704, ""name"": ""ancient world""}, {""id"": 158553, ""name"": ""pyre""}, {""id"": 162861, ""name"": ""ancient greece""}, {""id"": 189601, ""name"": ""trojan horse""}, {""id"": 235615, ""name"": ""trojan""}, {""id"": 235616, ""name"": ""bronze age""}, {""id"": 235617, ""name"": ""sparta greece""}, {""id"": 235618, ""name"": ""helen of troy""}, {""id"": 235619, ""name"": ""homer's iliad""}]",en,Troy,"In year 1250 B.C. during the late Bronze age, two emerging nations begin to clash. Paris, the Trojan prince, convinces Helen, Queen of Sparta, to leave her husband Menelaus, and sail with him back to Troy. After Menelaus finds out that his wife was taken by the Trojans, he asks his brother Agamemnom to help him get her back. Agamemnon sees this as an opportunity for power. So they set off with 1,000 ships holding 50,000 Greeks to Troy. With the help of Achilles, the Greeks are able to fight the never before defeated Trojans.",66.803149,"[{""name"": ""Plan B Entertainment"", ""id"": 81}, {""name"": ""Warner Bros."", ""id"": 6194}, {""name"": ""Nimar Studios"", ""id"": 7636}, {""name"": ""Radiant Productions"", ""id"": 18990}, {""name"": ""Helena Productions"", ""id"": 19107}, {""name"": ""Latina Pictures"", ""id"": 19108}]","[{""iso_3166_1"": ""US"", ""name"": ""United States of America""}, {""iso_3166_1"": ""MT"", ""name"": ""Malta""}, {""iso_3166_1"": ""GB"", ""name"": ""United Kingdom""}]",2004-05-13T00:00:00.000Z,497409852,163,"[{""iso_639_1"": ""en"", ""name"": ""English""}]",Released,For passion. For honor. For destiny. For victory. For love.,Troy,6.9,2759,Troy
145000000,"[{""id"": 16, ""name"": ""Animation""}, {""id"": 10751, ""name"": ""Family""}]",,80321,"[{""id"": 3645, ""name"": ""madagascar""}, {""id"": 209714, ""name"": ""3d""}]",en,Madagascar 3: Europe's Most Wanted,"Alex, Marty, Gloria and Melman are still trying to get back to the Big Apple and their beloved Central Park zoo, but first they need to find the penguins. When they travel to Monte Carlo, they attract the attention of Animal Control after gate crashing a party and are joined by the penguins, King Julian and Co., and the monkeys. How do a lion, zebra, hippo, giraffe, four penguins, two monkeys, three lemurs travel through Europe without attracting attention and get back to New York? They join a traveling circus. Their attempts to get back to New York are consistently hampered by the Captain of Animal Control who wants to make Alex part of her collection. Once they make it back to New York Marty, Alex, Gloria and Melman realize that they want to be part of the traveling circus.",44.989192,"[{""name"": ""DreamWorks Animation"", ""id"": 521}]","[{""iso_3166_1"": ""US"", ""name"": ""United States of America""}]",2012-06-06T00:00:00.000Z,746921274,93,"[{""iso_639_1"": ""en"", ""name"": ""English""}, {""iso_639_1"": ""es"", ""name"": ""Espa\u00f1ol""}, {""iso_639_1"": ""th"", ""name"": ""\u0e20\u0e32\u0e29\u0e32\u0e44\u0e17\u0e22""}]",Released,"Six years ago, they disappeared without a trace. Next summer, they finally resurface.",Madagascar 3: Europe's Most Wanted,6.4,1808,Madagascar 3: Europe's Most Wanted
140000000,"[{""id"": 12, ""name"": ""Adventure""}, {""id"": 28, ""name"": ""Action""}, {""id"": 53, ""name"": ""Thriller""}]",http://www.mgm.com/view/movie/232/Die-Another-Day/,36669,"[{""id"": 3290, ""name"": ""laser""}, {""id"": 156095, ""name"": ""british secret service""}, {""id"": 208633, ""name"": ""secret service agent""}, {""id"": 234365, ""name"": ""space based weapon""}]",en,Die Another Day,"Bond takes on a North Korean leader who undergoes DNA replacement procedures that allow him to assume different identities. American agent, Jinx Johnson assists Bond in his attempt to thwart the villain's plans to exploit a satellite that is powered by solar energy.",54.159392,"[{""name"": ""Eon Productions"", ""id"": 7576}]","[{""iso_3166_1"": ""GB"", ""name"": ""United Kingdom""}, {""iso_3166_1"": ""US"", ""name"": ""United States of America""}]",2002-11-17T00:00:00.000Z,431971116,133,"[{""iso_639_1"": ""en"", ""name"": ""English""}, {""iso_639_1"": ""ko"", ""name"": ""\ud55c\uad6d\uc5b4/\uc870\uc120\ub9d0""}, {""iso_639_1"": ""cn"", ""name"": ""\u5e7f\u5dde\u8bdd / \u5ee3\u5dde\u8a71""}, {""iso_639_1"": ""de"", ""name"": ""Deutsch""}, {""iso_639_1"": ""es"", ""name"": ""Espa\u00f1ol""}, {""iso_639_1"": ""is"", ""name"": ""\u00cdslenska""}, {""iso_639_1"": ""it"", ""name"": ""Italiano""}]",Released,He’s never been cooler.,Die Another Day,5.8,1092,Die Another Day
144000000,"[{""id"": 28, ""name"": ""Action""}, {""id"": 14, ""name"": ""Fantasy""}, {""id"": 35, ""name"": ""Comedy""}]",http://www.ghostbusters.com/,43074,"[{""id"": 5248, ""name"": ""female friendship""}, {""id"": 15040, ""name"": ""ghost hunting""}, {""id"": 161184, ""name"": ""reboot""}, {""id"": 162846, ""name"": ""ghost""}]",en,Ghostbusters,"Following a ghost invasion of Manhattan, paranormal enthusiasts Erin Gilbert and Abby Yates, nuclear engineer Jillian Holtzmann, and subway worker Patty Tolan band together to stop the otherworldly threat.",66.21806,"[{""name"": ""Columbia Pictures"", ""id"": 5}, {""name"": ""Village Roadshow Pictures"", ""id"": 79}, {""name"": ""Montecito Picture Company, The"", ""id"": 4607}, {""name"": ""LStar Capital"", ""id"": 34034}, {""name"": ""Feigco Entertainment"", ""id"": 61791}, {""name"": ""Pascal Pictures"", ""id"": 84041}, {""name"": ""Ghostcorps"", ""id"": 84042}]","[{""iso_3166_1"": ""US"", ""name"": ""United States of America""}]",2016-07-14T00:00:00.000Z,229147509,116,"[{""iso_639_1"": ""en"", ""name"": ""English""}]",Released,Who You Gonna Call?,Ghostbusters,5.3,2142,Ghostbusters
140000000,"[{""id"": 28, ""name"": ""Action""}, {""id"": 53, ""name"": ""Thriller""}, {""id"": 878, ""name"": ""Science Fiction""}, {""id"": 12, ""name"": ""Adventure""}]",,95,"[{""id"": 83, ""name"": ""saving the world""}, {""id"": 90, ""name"": ""paris""}, {""id"": 305, ""name"": ""moon""}, {""id"": 843, ""name"": ""cataclysm""}, {""id"": 1423, ""name"": ""asteroid""}, {""id"": 1430, ""name"": ""self sacrifice""}, {""id"": 1432, ""name"": ""nasa""}, {""id"": 1826, ""name"": ""space marine""}, {""id"": 1872, ""name"": ""loss of father""}, {""id"": 5600, ""name"": ""daughter""}, {""id"": 9882, ""name"": ""space""}, {""id"": 13027, ""name"": ""wedding""}, {""id"": 14626, ""name"": ""astronaut""}, {""id"": 164889, ""name"": ""eiffel tower paris""}, {""id"": 179431, ""name"": ""duringcreditsstinger""}, {""id"": 199076, ""name"": ""disaster movie""}, {""id"": 211487, ""name"": ""space centre""}]",en,Armageddon,"When an asteroid threatens to collide with Earth, NASA honcho Dan Truman determines the only way to stop it is to drill into its surface and detonate a nuclear bomb. This leads him to renowned driller Harry Stamper, who agrees to helm the dangerous space mission provided he can bring along his own hotshot crew. Among them is the cocksure A.J. who Harry thinks isn't good enough for his daughter, until the mission proves otherwise.",58.485967,"[{""name"": ""Jerry Bruckheimer Films"", ""id"": 130}, {""name"": ""Touchstone Pictures"", ""id"": 9195}, {""name"": ""Valhalla Motion Pictures"", ""id"": 11533}]","[{""iso_3166_1"": ""US"", ""name"": ""United States of America""}]",1998-07-01T00:00:00.000Z,553799566,151,"[{""iso_639_1"": ""en"", ""name"": ""English""}, {""iso_639_1"": ""ru"", ""name"": ""P\u0443\u0441\u0441\u043a\u0438\u0439""}]",Released,The Earth's Darkest Day Will Be Man's Finest Hour,Armageddon,6.4,2482,Armageddon
140000000,"[{""id"": 28, ""name"": ""Action""}, {""id"": 12, ""name"": ""Adventure""}, {""id"": 35, ""name"": ""Comedy""}, {""id"": 878, ""name"": ""Science Fiction""}]",http://www.sonypictures.com/homevideo/meninblackii/,608,"[{""id"": 83, ""name"": ""saving the world""}, {""id"": 1308, ""name"": ""secret identity""}, {""id"": 1381, ""name"": ""sun glasses""}, {""id"": 1568, ""name"": ""undercover""}, {""id"": 1826, ""name"": ""space marine""}, {""id"": 2173, ""name"": ""illegal immigration""}, {""id"": 2428, ""name"": ""deportation""}, {""id"": 2547, ""name"": ""new identity""}, {""id"": 3243, ""name"": ""flying saucer""}, {""id"": 3760, ""name"": ""light""}, {""id"": 6112, ""name"": ""firearm""}, {""id"": 9951, ""name"": ""alien""}, {""id"": 174915, ""name"": ""fictional government agency""}]",en,Men in Black II,"Kay and Jay reunite to provide our best, last and only line of defense against a sinister seductress who levels the toughest challenge yet to the MIB's untarnished mission statement – protecting Earth from the scum of the universe. It's been four years since the alien-seeking agents averted an intergalactic disaster of epic proportions. Now it's a race against the clock as Jay must convince Kay – who not only has absolutely no memory of his time spent with the MIB, but is also the only living person left with the expertise to save the galaxy – to reunite with the MIB before the earth submits to ultimate destruction.",91.332849,"[{""name"": ""Columbia Pictures"", ""id"": 5}, {""name"": ""Amblin Entertainment"", ""id"": 56}, {""name"": ""Columbia Pictures Corporation"", ""id"": 441}, {""name"": ""Parkes+MacDonald Image Nation"", ""id"": 49325}]","[{""iso_3166_1"": ""US"", ""name"": ""United States of America""}]",2002-07-03T00:00:00.000Z,441818803,88,"[{""iso_639_1"": ""en"", ""name"": ""English""}]",Released,Same Planet. New Scum.,Men in Black II,6,3114,Men in Black II
70000000,"[{""id"": 12, ""name"": ""Adventure""}, {""id"": 28, ""name"": ""Action""}, {""id"": 16, ""name"": ""Animation""}]",http://www.beowulfmovie.com/,2310,"[{""id"": 509, ""name"": ""denmark""}, {""id"": 2037, ""name"": ""nordic mythology""}, {""id"": 2251, ""name"": ""lie""}, {""id"": 3932, ""name"": ""pride and vanity""}, {""id"": 4615, ""name"": ""folk hero""}, {""id"": 5035, ""name"": ""human weakness""}, {""id"": 5895, ""name"": ""viking""}, {""id"": 7368, ""name"": ""alienation""}, {""id"": 7411, ""name"": ""festival hall""}, {""id"": 7412, ""name"": ""sin""}, {""id"": 9920, ""name"": ""royalty""}, {""id"": 10541, ""name"": ""curse""}, {""id"": 14643, ""name"": ""battle""}, {""id"": 14704, ""name"": ""ancient world""}, {""id"": 161919, ""name"": ""adult animation""}, {""id"": 196544, ""name"": ""motion capture""}]",en,Beowulf,"6th-century Scandinavian warrior, Beowulf embarks on a mission to slay the manlike ogre Grendel, a descendant of Cain.",35.601665,"[{""name"": ""Paramount Pictures"", ""id"": 4}, {""name"": ""Shangri-La Entertainment"", ""id"": 2265}, {""name"": ""ImageMovers"", ""id"": 11395}, {""name"": ""Paramount Animation"", ""id"": 24955}]","[{""iso_3166_1"": ""US"", ""name"": ""United States of America""}]",2007-11-05T00:00:00.000Z,195735876,115,"[{""iso_639_1"": ""en"", ""name"": ""English""}]",Released,Evil breeds pain.,Beowulf,5.5,841,Beowulf
145000000,"[{""id"": 28, ""name"": ""Action""}, {""id"": 12, ""name"": ""Adventure""}, {""id"": 16, ""name"": ""Animation""}, {""id"": 35, ""name"": ""Comedy""}, {""id"": 10751, ""name"": ""Family""}]",http://www.kungfupanda.com/,140300,"[{""id"": 478, ""name"": ""china""}, {""id"": 779, ""name"": ""martial arts""}, {""id"": 780, ""name"": ""kung fu""}, {""id"": 5331, ""name"": ""village""}, {""id"": 8531, ""name"": ""panda""}, {""id"": 9663, ""name"": ""sequel""}, {""id"": 11477, ""name"": ""talking animal""}, {""id"": 11500, ""name"": ""anthropomorphism""}, {""id"": 12554, ""name"": ""dragon""}, {""id"": 15036, ""name"": ""ancient china""}, {""id"": 184656, ""name"": ""wuxia""}, {""id"": 187056, ""name"": ""woman director""}]",en,Kung Fu Panda 3,"Continuing his ""legendary adventures of awesomeness"", Po must face two hugely epic, but different threats: one supernatural and the other a little closer to his home.",56.747978,"[{""name"": ""Twentieth Century Fox Film Corporation"", ""id"": 306}, {""name"": ""DreamWorks Animation"", ""id"": 521}, {""name"": ""China Film Co."", ""id"": 40890}, {""name"": ""Oriental DreamWorks"", ""id"": 76266}]","[{""iso_3166_1"": ""CN"", ""name"": ""China""}, {""iso_3166_1"": ""US"", ""name"": ""United States of America""}]",2016-01-23T00:00:00.000Z,521170825,95,"[{""iso_639_1"": ""en"", ""name"": ""English""}]",Released,Grab destiny by the rice dumplings.,Kung Fu Panda 3,6.7,1603,Kung Fu Panda 3
145000000,"[{""id"": 28, ""name"": ""Action""}, {""id"": 53, ""name"": ""Thriller""}, {""id"": 12, ""name"": ""Adventure""}]",http://www.missionimpossible.com/,56292,"[{""id"": 1721, ""name"": ""fight""}, {""id"": 9663, ""name"": ""sequel""}, {""id"": 10364, ""name"": ""mission""}, {""id"": 14601, ""name"": ""explosion""}, {""id"": 17992, ""name"": ""broken arm""}, {""id"": 156395, ""name"": ""imax""}, {""id"": 156767, ""name"": ""nuclear threat""}]",en,Mission: Impossible - Ghost Protocol,"In the 4th installment of the Mission Impossible series, Ethan Hunt (Cruise) and his team are racing against time to track down a dangerous terrorist named Hendricks (Nyqvist), who has gained access to Russian nuclear launch codes and is planning a strike on the United States. An attempt to stop him ends in an explosion causing severe destruction to the Kremlin and the IMF to be implicated in the bombing, forcing the President to disavow them. No longer being aided by the government, Ethan and his team chase Hendricks around the globe, although they might still be too late to stop a disaster.",77.77477,"[{""name"": ""Paramount Pictures"", ""id"": 4}, {""name"": ""Skydance Productions"", ""id"": 6277}, {""name"": ""Bad Robot"", ""id"": 11461}, {""name"": ""TC Productions"", ""id"": 21777}, {""name"": ""Revolution Sun Studios"", ""id"": 76043}, {""name"": ""Kontsept Film Company"", ""id"": 76067}]","[{""iso_3166_1"": ""CZ"", ""name"": ""Czech Republic""}, {""iso_3166_1"": ""US"", ""name"": ""United States of America""}, {""iso_3166_1"": ""AE"", ""name"": ""United Arab Emirates""}]",2011-12-07T00:00:00.000Z,694713380,133,"[{""iso_639_1"": ""en"", ""name"": ""English""}, {""iso_639_1"": ""ru"", ""name"": ""P\u0443\u0441\u0441\u043a\u0438\u0439""}, {""iso_639_1"": ""fr"", ""name"": ""Fran\u00e7ais""}, {""iso_639_1"": ""ar"", ""name"": ""\u0627\u0644\u0639\u0631\u0628\u064a\u0629""}, {""iso_639_1"": ""sv"", ""name"": ""svenska""}]",Released,No Plan. No Backup. No Choice.,Mission: Impossible - Ghost Protocol,6.8,3972,Mission: Impossible - Ghost Protocol
145000000,"[{""id"": 14, ""name"": ""Fantasy""}, {""id"": 16, ""name"": ""Animation""}, {""id"": 10751, ""name"": ""Family""}]",http://www.riseoftheguardians.com/,81188,"[{""id"": 1566, ""name"": ""dream""}, {""id"": 1991, ""name"": ""santa claus""}, {""id"": 3030, ""name"": ""nightmare""}, {""id"": 9923, ""name"": ""easter bunny""}, {""id"": 33597, ""name"": ""tooth fairy""}, {""id"": 41581, ""name"": ""jack frost""}, {""id"": 41584, ""name"": ""sandman""}, {""id"": 179431, ""name"": ""duringcreditsstinger""}]",en,Rise of the Guardians,"When an evil spirit known as Pitch lays down the gauntlet to take over the world, the immortal Guardians must join forces for the first time to protect the hopes, beliefs and imagination of children all over the world.",61.788035,"[{""name"": ""DreamWorks Animation"", ""id"": 521}]","[{""iso_3166_1"": ""US"", ""name"": ""United States of America""}]",2012-11-21T00:00:00.000Z,306941670,97,"[{""iso_639_1"": ""fr"", ""name"": ""Fran\u00e7ais""}, {""iso_639_1"": ""en"", ""name"": ""English""}]",Released,You better believe.,Rise of the Guardians,7.1,1922,Rise of the Guardians
100000000,"[{""id"": 35, ""name"": ""Comedy""}]",http://www.sonypictures.com/movies/funwithdickandjane/,7552,"[{""id"": 818, ""name"": ""based on novel""}, {""id"": 1333, ""name"": ""desperation""}, {""id"": 1621, ""name"": ""robber""}, {""id"": 3607, ""name"": ""hold-up robbery""}, {""id"": 9714, ""name"": ""remake""}, {""id"": 10532, ""name"": ""suburbia""}, {""id"": 14549, ""name"": ""loss of job""}, {""id"": 33740, ""name"": ""humiliation""}, {""id"": 156052, ""name"": ""unemployment""}, {""id"": 157296, ""name"": ""bankruptcy""}, {""id"": 160510, ""name"": ""travel agent""}, {""id"": 211295, ""name"": ""riches to rags""}, {""id"": 227863, ""name"": ""bearer bonds""}, {""id"": 227864, ""name"": ""comeuppance""}]",en,Fun with Dick and Jane,"After Dick Harper loses his job at Globodyne in an Enron-esque collapse, he and his wife, Jane, turn to crime in order to handle the massive debt they now face. Two intelligent people, Dick and Jane actually get pretty good at robbing people and even enjoy it -- but they have second thoughts when they're reminded that crime can hurt innocent people. When the couple hears that Globodyne boss Jack McCallister actually swindled the company, they plot revenge.",25.159168,"[{""name"": ""Imagine Entertainment"", ""id"": 23}, {""name"": ""Columbia Pictures Corporation"", ""id"": 441}, {""name"": ""JC 23 Entertainment"", ""id"": 76714}]","[{""iso_3166_1"": ""US"", ""name"": ""United States of America""}]",2005-12-21T00:00:00.000Z,202026112,90,"[{""iso_639_1"": ""en"", ""name"": ""English""}]",Released,Giving big businesses a run for their money!,Fun with Dick and Jane,5.9,627,Fun with Dick and Jane
140000000,"[{""id"": 18, ""name"": ""Drama""}, {""id"": 28, ""name"": ""Action""}, {""id"": 10752, ""name"": ""War""}, {""id"": 36, ""name"": ""History""}]",,616,"[{""id"": 233, ""name"": ""japan""}, {""id"": 1327, ""name"": ""war crimes""}, {""id"": 1335, ""name"": ""sense of guilt""}, {""id"": 1400, ""name"": ""swordplay""}, {""id"": 1402, ""name"": ""general""}, {""id"": 1462, ""name"": ""samurai""}, {""id"": 1543, ""name"": ""war veteran""}, {""id"": 1908, ""name"": ""katana""}, {""id"": 1938, ""name"": ""sword""}, {""id"": 2001, ""name"": ""arms deal""}, {""id"": 2156, ""name"": ""homeland""}, {""id"": 2280, ""name"": ""emperor""}, {""id"": 2568, ""name"": ""language barrier""}, {""id"": 2796, ""name"": ""self-discovery""}, {""id"": 2802, ""name"": ""mountain village""}, {""id"": 2905, ""name"": ""foreign legion""}, {""id"": 3070, ""name"": ""mercenary""}, {""id"": 3072, ""name"": ""campaign""}, {""id"": 3073, ""name"": ""commercial agreement""}, {""id"": 3074, ""name"": ""insurgence""}, {""id"": 3077, ""name"": ""leader""}, {""id"": 3078, ""name"": ""war strategy""}, {""id"": 3080, ""name"": ""gettysburg""}, {""id"": 4549, ""name"": ""loss of husband""}, {""id"": 10089, ""name"": ""slaughter""}, {""id"": 13065, ""name"": ""soldier""}, {""id"": 33457, ""name"": ""alcoholic""}, {""id"": 33564, ""name"": ""u.s. soldier""}, {""id"": 170007, ""name"": ""japanese army""}, {""id"": 207928, ""name"": ""19th century""}, {""id"": 220492, ""name"": ""war trauma""}]",en,The Last Samurai,"Nathan Algren is an American hired to instruct the Japanese army in the ways of modern warfare, which finds him learning to respect the samurai and the honorable principles that rule them. Pressed to destroy the samurai's way of life in the name of modernization and open trade, Algren decides to become an ultimate warrior himself and to fight for their right to exist.",52.341226,"[{""name"": ""Cruise/Wagner Productions"", ""id"": 44}, {""name"": ""Warner Bros."", ""id"": 6194}, {""name"": ""Radar Pictures"", ""id"": 14718}, {""name"": ""Bedford Falls Company, The"", ""id"": 20634}]","[{""iso_3166_1"": ""JP"", ""name"": ""Japan""}, {""iso_3166_1"": ""US"", ""name"": ""United States of America""}, {""iso_3166_1"": ""NZ"", ""name"": ""New Zealand""}]",2003-12-05T00:00:00.000Z,456758981,154,"[{""iso_639_1"": ""en"", ""name"": ""English""}, {""iso_639_1"": ""ja"", ""name"": ""\u65e5\u672c\u8a9e""}]",Released,"In the face of an enemy, in the heart of one man, lies the soul of a warrior.",The Last Samurai,7.3,1895,The Last Samurai
140000000,"[{""id"": 12, ""name"": ""Adventure""}, {""id"": 18, ""name"": ""Drama""}, {""id"": 28, ""name"": ""Action""}]",http://www.exodusgodsandkings.com/,147441,"[{""id"": 488, ""name"": ""moses""}, {""id"": 3036, ""name"": ""bible""}, {""id"": 157894, ""name"": ""ancient egypt""}, {""id"": 209714, ""name"": ""3d""}, {""id"": 211105, ""name"": ""ramses""}]",en,Exodus: Gods and Kings,"The defiant leader Moses rises up against the Egyptian Pharaoh Ramses, setting 400,000 slaves on a monumental journey of escape from Egypt and its terrifying cycle of deadly plagues.",101.599427,"[{""name"": ""Scott Free Productions"", ""id"": 1645}, {""name"": ""Chernin Entertainment"", ""id"": 7076}, {""name"": ""Babieka"", ""id"": 20656}, {""name"": ""Volcano Films"", ""id"": 52184}]","[{""iso_3166_1"": ""ES"", ""name"": ""Spain""}, {""iso_3166_1"": ""GB"", ""name"": ""United Kingdom""}, {""iso_3166_1"": ""US"", ""name"": ""United States of America""}]",2014-12-03T00:00:00.000Z,268031828,150,"[{""iso_639_1"": ""en"", ""name"": ""English""}]",Released,"Once brothers, now enemies.",Exodus: Gods and Kings,5.6,1921,Exodus: Gods and Kings
150000000,"[{""id"": 878, ""name"": ""Science Fiction""}, {""id"": 28, ""name"": ""Action""}, {""id"": 12, ""name"": ""Adventure""}]",,13475,"[{""id"": 1612, ""name"": ""spacecraft""}, {""id"": 3822, ""name"": ""teleportation""}, {""id"": 4040, ""name"": ""space mission""}, {""id"": 4300, ""name"": ""parachute""}, {""id"": 4379, ""name"": ""time travel""}, {""id"": 4380, ""name"": ""black hole""}, {""id"": 5100, ""name"": ""supernova""}, {""id"": 9675, ""name"": ""prequel""}, {""id"": 9684, ""name"": ""warp speed""}, {""id"": 9685, ""name"": ""futuristic""}, {""id"": 9686, ""name"": ""warp engine""}, {""id"": 12388, ""name"": ""romulans""}, {""id"": 12405, ""name"": ""outer space""}, {""id"": 155212, ""name"": ""vulcan""}, {""id"": 156282, ""name"": ""alternate reality""}, {""id"": 161176, ""name"": ""space opera""}, {""id"": 161184, ""name"": ""reboot""}]",en,Star Trek,"The fate of the galaxy rests in the hands of bitter rivals. One, James Kirk, is a delinquent, thrill-seeking Iowa farm boy. The other, Spock, a Vulcan, was raised in a logic-based society that rejects all emotion. As fiery instinct clashes with calm reason, their unlikely but powerful partnership is the only thing capable of leading their crew through unimaginable danger, boldly going where no one has gone before. The human adventure has begun again.",73.616808,"[{""name"": ""Paramount Pictures"", ""id"": 4}, {""name"": ""Spyglass Entertainment"", ""id"": 158}, {""name"": ""Bad Robot"", ""id"": 11461}, {""name"": ""MavroCine Pictures GmbH & Co. KG"", ""id"": 23419}]","[{""iso_3166_1"": ""DE"", ""name"": ""Germany""}, {""iso_3166_1"": ""US"", ""name"": ""United States of America""}]",2009-05-06T00:00:00.000Z,385680446,127,"[{""iso_639_1"": ""en"", ""name"": ""English""}]",Released,The future begins.,Star Trek,7.4,4518,Star Trek
139000000,"[{""id"": 14, ""name"": ""Fantasy""}, {""id"": 28, ""name"": ""Action""}]",http://www.sonypictures.com/movies/spider-man/,557,"[{""id"": 1014, ""name"": ""loss of lover""}, {""id"": 3986, ""name"": ""spider""}, {""id"": 4543, ""name"": ""thanksgiving""}, {""id"": 5812, ""name"": ""bad boss""}, {""id"": 6062, ""name"": ""hostility""}, {""id"": 8828, ""name"": ""marvel comic""}, {""id"": 9715, ""name"": ""superhero""}, {""id"": 11794, ""name"": ""pokies""}, {""id"": 156075, ""name"": ""evil""}, {""id"": 169887, ""name"": ""reference to superman""}, {""id"": 189094, ""name"": ""goblin""}]",en,Spider-Man,"After being bitten by a genetically altered spider, nerdy high school student Peter Parker is endowed with amazing powers.",82.502566,"[{""name"": ""Columbia Pictures"", ""id"": 5}, {""name"": ""Marvel Enterprises"", ""id"": 19551}]","[{""iso_3166_1"": ""US"", ""name"": ""United States of America""}]",2002-05-01T00:00:00.000Z,821708551,121,"[{""iso_639_1"": ""en"", ""name"": ""English""}]",Released,With great power comes great responsibility.,Spider-Man,6.8,5265,Spider-Man
